{
  "kind": "autonomous-mutation-journal",
  "schema_version": "v1",
  "journal_id": "macro-route-revert-journal",
  "domain": "macro-routing",
  "constitution_digest": "sha256:51efdb78c4524780919649f285862543db8b38a6a3a07894f0fad8bdab40fc6c",
  "binding": {
    "mutation_id": "macro-revert-mutation",
    "attempt_id": "macro-revert-attempt",
    "recovery_disarm_id": "macro-revert-disarm",
    "idempotency_key": "macro-revert-idem",
    "writer_owner": "hugin",
    "owner_authority_ref": "ref:hugin-owner-authority",
    "owner_authority_digest": "sha256:aaaaaaaaaaaaaaaaaaaaaaaaaaaaaaaaaaaaaaaaaaaaaaaaaaaaaaaaaaaaaaaa",
    "configuration_owner": "hugin",
    "configuration_owner_authority_ref": "ref:macro-route-config-owner-attestation",
    "configuration_owner_authority_digest": "sha256:928ee4f53dd66d9d0f1fa16f1d1479b923df23554c65891e39f4b3780a836b4d",
    "target_scope_digest": "sha256:2222222222222222222222222222222222222222222222222222222222222222",
    "admission_coverage_digest": "sha256:bab7f9befaed14ede60ff049ec85630c5ac0c6e99b48a5ca175101689ba8649a",
    "admission_binding_state": "armed-canary",
    "owner_identity": "hugin-owner",
    "controller_identity": "macro-route-controller",
    "watchdog_identity": "macro-route-watchdog",
    "kill_switch_identity": "macro-route-kill-switch",
    "recovery_worker_identity": "macro-route-revert-worker",
    "risk_scope": "macro-routing",
    "candidate_digest": "sha256:aaaaaaaaaaaaaaaaaaaaaaaaaaaaaaaaaaaaaaaaaaaaaaaaaaaaaaaaaaaaaaaa",
    "config_digest": "sha256:bbbbbbbbbbbbbbbbbbbbbbbbbbbbbbbbbbbbbbbbbbbbbbbbbbbbbbbbbbbbbbbb",
    "evidence_digest": "sha256:cccccccccccccccccccccccccccccccccccccccccccccccccccccccccccccccc",
    "policy_digest": "sha256:dddddddddddddddddddddddddddddddddddddddddddddddddddddddddddddddd",
    "baseline_digest": "sha256:eeeeeeeeeeeeeeeeeeeeeeeeeeeeeeeeeeeeeeeeeeeeeeeeeeeeeeeeeeeeeeee",
    "postconditions_digest": "sha256:ffffffffffffffffffffffffffffffffffffffffffffffffffffffffffffffff",
    "deadline": "2026-07-26T01:00:00Z",
    "canary": {
      "scope_digest": "sha256:2222222222222222222222222222222222222222222222222222222222222222",
      "target_count": 1,
      "watch_deadline": "2026-07-26T00:30:00Z"
    },
    "recovery": {
      "class": "R-exact",
      "worker_identity": "macro-route-revert-worker",
      "descriptor_digest": "sha256:2222222222222222222222222222222222222222222222222222222222222222",
      "disarms_after_action": true
    }
  },
  "binding_digest": "sha256:c72583c4c119a232d9eabcc278600633c464af7de3a463ac474fa5ef8ec755a5",
  "entries": [
    {
      "entry_id": "macro-revert-prepare",
      "sequence": 1,
      "recorded_at": "2026-07-26T00:00:00Z",
      "phase": "prepare",
      "outcome": "prepared",
      "executor_identity": "macro-route-controller",
      "binding_digest": "sha256:c72583c4c119a232d9eabcc278600633c464af7de3a463ac474fa5ef8ec755a5",
      "quarantine": {
        "state": "not-applicable",
        "reason_digest": "sha256:3333333333333333333333333333333333333333333333333333333333333333"
      },
      "terminal_reason_digest": null,
      "previous_receipt_digest": null,
      "receipt_digest": "sha256:a73d53535ed93dc4426240dc2bd265b75fcf1e856563c7ba49b8359c5672bad6",
      "content_refs": [
        "ref:macro-revert-candidate"
      ],
      "coverage_transition": null
    },
    {
      "entry_id": "macro-revert-apply",
      "sequence": 2,
      "recorded_at": "2026-07-26T00:05:00Z",
      "phase": "apply",
      "outcome": "applied",
      "executor_identity": "macro-route-controller",
      "binding_digest": "sha256:c72583c4c119a232d9eabcc278600633c464af7de3a463ac474fa5ef8ec755a5",
      "quarantine": {
        "state": "not-applicable",
        "reason_digest": "sha256:3333333333333333333333333333333333333333333333333333333333333333"
      },
      "terminal_reason_digest": null,
      "previous_receipt_digest": "sha256:a73d53535ed93dc4426240dc2bd265b75fcf1e856563c7ba49b8359c5672bad6",
      "receipt_digest": "sha256:c126729a9d9c2a9744c5fbdb98711d3030a0534274d8fbf11e1c103100a1083f",
      "content_refs": [
        "ref:macro-revert-candidate"
      ],
      "coverage_transition": null
    },
    {
      "entry_id": "macro-revert-unknown",
      "sequence": 3,
      "recorded_at": "2026-07-26T01:01:00Z",
      "phase": "unknown",
      "outcome": "unknown",
      "executor_identity": "macro-route-controller",
      "binding_digest": "sha256:c72583c4c119a232d9eabcc278600633c464af7de3a463ac474fa5ef8ec755a5",
      "quarantine": {
        "state": "not-applicable",
        "reason_digest": "sha256:3333333333333333333333333333333333333333333333333333333333333333"
      },
      "terminal_reason_digest": "sha256:6666666666666666666666666666666666666666666666666666666666666666",
      "previous_receipt_digest": "sha256:c126729a9d9c2a9744c5fbdb98711d3030a0534274d8fbf11e1c103100a1083f",
      "receipt_digest": "sha256:a1f0219fa1c73f3508a5feab8b0a2f5a8e3b03a6944b6457b95ec5241b632244",
      "content_refs": [
        "ref:macro-revert-candidate"
      ],
      "coverage_transition": null
    },
    {
      "entry_id": "macro-revert-action",
      "sequence": 4,
      "recorded_at": "2026-07-26T01:02:00Z",
      "phase": "revert",
      "outcome": "reverted",
      "executor_identity": "macro-route-revert-worker",
      "binding_digest": "sha256:c72583c4c119a232d9eabcc278600633c464af7de3a463ac474fa5ef8ec755a5",
      "quarantine": {
        "state": "not-applicable",
        "reason_digest": "sha256:3333333333333333333333333333333333333333333333333333333333333333"
      },
      "terminal_reason_digest": null,
      "previous_receipt_digest": "sha256:a1f0219fa1c73f3508a5feab8b0a2f5a8e3b03a6944b6457b95ec5241b632244",
      "receipt_digest": "sha256:7919604d7d0031b4278774f2185b4ef95e2f2d9a52e1ad84cc6c20009c2d814f",
      "content_refs": [
        "ref:macro-revert-candidate"
      ],
      "coverage_transition": null
    },
    {
      "entry_id": "macro-revert-disarm",
      "sequence": 5,
      "recorded_at": "2026-07-26T01:03:00Z",
      "phase": "disarm",
      "outcome": "disarmed",
      "executor_identity": "macro-route-revert-worker",
      "binding_digest": "sha256:c72583c4c119a232d9eabcc278600633c464af7de3a463ac474fa5ef8ec755a5",
      "quarantine": {
        "state": "not-applicable",
        "reason_digest": "sha256:3333333333333333333333333333333333333333333333333333333333333333"
      },
      "terminal_reason_digest": "sha256:6666666666666666666666666666666666666666666666666666666666666666",
      "previous_receipt_digest": "sha256:7919604d7d0031b4278774f2185b4ef95e2f2d9a52e1ad84cc6c20009c2d814f",
      "receipt_digest": "sha256:a6b357d5c3da225d2c47666aa0d32e804351e0d5d6f48539555abf4d56e524d3",
      "content_refs": [
        "ref:macro-revert-candidate"
      ],
      "coverage_transition": {
        "from_state": "armed-canary",
        "to_state": "shadow",
        "target_scope_digest": "sha256:2222222222222222222222222222222222222222222222222222222222222222",
        "actor_identity": "macro-route-revert-worker"
      }
    }
  ],
  "extensions": []
}
